[
  {
    "title": "contradiction-reclassification",
    "candidate_type": "framework",
    "summary": "矛盾排序必须是可改判的阶段假设，并禁止把普通分歧转化为敌我身份。",
    "evidence_ids": [
      "ev-20260806175133382918-ac087ad7",
      "ev-20260806175133382950-9b608ed4"
    ],
    "source_contexts": [
      "https://www.12371.cn/special/mzdxj/dyj/#on-contradiction::结构化主张：阶段性分类",
      "https://www.gov.cn/test/2008-06/23/content_1024934_3.htm::结构化主张：阶段性分类"
    ],
    "tags": [
      "methodology",
      "structured-claim",
      "contradiction-reclassification"
    ],
    "source_ids": [
      "https://www.12371.cn/special/mzdxj/dyj/#on-contradiction",
      "https://www.gov.cn/test/2008-06/23/content_1024934_3.htm"
    ],
    "independence_groups": [
      "mao-authorized-works",
      "1981-central-resolution"
    ],
    "id": "candidate-20260806175133382965-b399b31b",
    "cross_domain": true,
    "source_independent": true,
    "predictive": false,
    "distinctive": true,
    "actionable": true,
    "status": "needs_model_verification",
    "rejection_reason": "V2 predictive-power test requires independent model or human review"
  },
  {
    "title": "feedback-integrity",
    "candidate_type": "framework",
    "summary": "可用的反馈方法必须把一线证据、暂时判断、可逆试验和独立坏消息通道组成闭环。",
    "evidence_ids": [
      "ev-20260806175133382979-ba5b5b95",
      "ev-20260806175133382989-33cf22cf",
      "ev-20260806175133382997-b6604d2f",
      "ev-20260806175133383005-042bef4c"
    ],
    "source_contexts": [
      "https://www.12371.cn/special/mzdxj/dyj/#investigation-practice::结构化主张：反馈完整性",
      "https://www.12371.cn/special/mzdxj/d3j/#leadership-methods::结构化主张：反馈完整性",
      "https://www.gov.cn/test/2008-06/23/content_1024934_3.htm::结构化主张：反馈完整性",
      "https://www.nber.org/papers/w16361::结构化主张：反馈完整性"
    ],
    "tags": [
      "methodology",
      "structured-claim",
      "feedback-integrity"
    ],
    "source_ids": [
      "https://www.12371.cn/special/mzdxj/dyj/#investigation-practice",
      "https://www.12371.cn/special/mzdxj/d3j/#leadership-methods",
      "https://www.gov.cn/test/2008-06/23/content_1024934_3.htm",
      "https://www.nber.org/papers/w16361"
    ],
    "independence_groups": [
      "mao-authorized-works",
      "1981-central-resolution",
      "nber-meng-qian-yared"
    ],
    "id": "candidate-20260806175133383016-818e71f5",
    "cross_domain": true,
    "source_independent": true,
    "predictive": false,
    "distinctive": true,
    "actionable": true,
    "status": "needs_model_verification",
    "rejection_reason": "V2 predictive-power test requires independent model or human review"
  },
  {
    "title": "rights-bound-transfer",
    "candidate_type": "principle",
    "summary": "历史方法的现代迁移必须以非暴力、守法、可逆、保留申辩和复核为硬边界。",
    "evidence_ids": [
      "ev-20260806175133383023-57bb97ec",
      "ev-20260806175133383032-ca24e71b",
      "ev-20260806175133383040-c9ffa765"
    ],
    "source_contexts": [
      "https://www.12371.cn/special/mzdxj/dyj/#on-contradiction::结构化主张：现代迁移边界",
      "https://www.12371.cn/special/mzdxj/d3j/#leadership-methods::结构化主张：现代迁移边界",
      "https://www.gov.cn/test/2008-06/23/content_1024934_3.htm::结构化主张：现代迁移边界"
    ],
    "tags": [
      "methodology",
      "structured-claim",
      "rights-bound-transfer"
    ],
    "source_ids": [
      "https://www.12371.cn/special/mzdxj/dyj/#on-contradiction",
      "https://www.12371.cn/special/mzdxj/d3j/#leadership-methods",
      "https://www.gov.cn/test/2008-06/23/content_1024934_3.htm"
    ],
    "independence_groups": [
      "mao-authorized-works",
      "1981-central-resolution"
    ],
    "id": "candidate-20260806175133383048-3ba6acd8",
    "cross_domain": true,
    "source_independent": true,
    "predictive": false,
    "distinctive": true,
    "actionable": true,
    "status": "needs_model_verification",
    "rejection_reason": "V2 predictive-power test requires independent model or human review"
  },
  {
    "title": "version-attribution",
    "candidate_type": "principle",
    "summary": "历史文本的方法蒸馏必须区分最终公开版本、现场记录和现代推断，不能伪造人物立场。",
    "evidence_ids": [
      "ev-20260806175133383055-b0abe1be",
      "ev-20260806175133383062-a70cee0c"
    ],
    "source_contexts": [
      "https://www.12371.cn/special/mzdxj/dyj/#investigation-practice::结构化主张：版本与归属",
      "https://www.dswxyjy.org.cn/n1/2021/0118/c219000-32003108.html::结构化主张：版本与归属"
    ],
    "tags": [
      "methodology",
      "structured-claim",
      "version-attribution"
    ],
    "source_ids": [
      "https://www.12371.cn/special/mzdxj/dyj/#investigation-practice",
      "https://www.dswxyjy.org.cn/n1/2021/0118/c219000-32003108.html"
    ],
    "independence_groups": [
      "mao-authorized-works",
      "party-history-institute-version-study"
    ],
    "id": "candidate-20260806175133383070-868d9a97",
    "cross_domain": true,
    "source_independent": true,
    "predictive": false,
    "distinctive": true,
    "actionable": true,
    "status": "needs_model_verification",
    "rejection_reason": "V2 predictive-power test requires independent model or human review"
  },
  {
    "title": "优先收集异常、失败和坏消息，再修正解释。",
    "candidate_type": "framework",
    "summary": "优先收集异常、失败和坏消息，再修正解释。",
    "evidence_ids": [
      "ev-20260806175133383837-5ef6e23a"
    ],
    "source_contexts": [
      "https://www.12371.cn/special/mzdxj/dyj/#investigation-practice::可迁移机制"
    ],
    "tags": [
      "methodology",
      "framework"
    ],
    "source_ids": [
      "https://www.12371.cn/special/mzdxj/dyj/#investigation-practice"
    ],
    "independence_groups": [
      "mao-authorized-works"
    ],
    "id": "candidate-20260806175133384005-86aa38d1",
    "cross_domain": false,
    "source_independent": false,
    "predictive": false,
    "distinctive": false,
    "actionable": true,
    "status": "rejected",
    "rejection_reason": "V1 requires recurrence in at least two source contexts; candidate may be generic or underspecified"
  },
  {
    "title": "中共中央党史和文献研究院的版本研究说明，《实践论》源自1937年讲课提纲，新中国成立...",
    "candidate_type": "counterexample",
    "summary": "中共中央党史和文献研究院的版本研究说明，《实践论》源自1937年讲课提纲，新中国成立后经过较大内容修改和多次文字处理。现行选集文本适合代表最终公开版本，但不能无说明地当作1937年现场逐字稿。",
    "evidence_ids": [
      "ev-20260806175133384041-7849349c"
    ],
    "source_contexts": [
      "https://www.12371.cn/special/mzdxj/dyj/#investigation-practice::证据边界"
    ],
    "tags": [
      "methodology",
      "counterexample"
    ],
    "source_ids": [
      "https://www.12371.cn/special/mzdxj/dyj/#investigation-practice"
    ],
    "independence_groups": [
      "mao-authorized-works"
    ],
    "id": "candidate-20260806175133384051-3c2e5af1",
    "cross_domain": false,
    "source_independent": false,
    "predictive": false,
    "distinctive": true,
    "actionable": false,
    "status": "rejected",
    "rejection_reason": "V1 requires recurrence in at least two source contexts; candidate is not yet executable"
  },
  {
    "title": "调查本身也不会自动产生正确判断。样本选择、提问方式、权力在场和既有立场都可能污染材料...",
    "candidate_type": "principle",
    "summary": "调查本身也不会自动产生正确判断。样本选择、提问方式、权力在场和既有立场都可能污染材料；因此现代迁移必须增加反证样本、独立记录和可撤回试点。",
    "evidence_ids": [
      "ev-20260806175133384069-6fc0137e"
    ],
    "source_contexts": [
      "https://www.12371.cn/special/mzdxj/dyj/#investigation-practice::证据边界"
    ],
    "tags": [
      "methodology",
      "principle"
    ],
    "source_ids": [
      "https://www.12371.cn/special/mzdxj/dyj/#investigation-practice"
    ],
    "independence_groups": [
      "mao-authorized-works"
    ],
    "id": "candidate-20260806175133384077-8f51bd26",
    "cross_domain": false,
    "source_independent": false,
    "predictive": false,
    "distinctive": true,
    "actionable": true,
    "status": "rejected",
    "rejection_reason": "V1 requires recurrence in at least two source contexts"
  },
  {
    "title": "Claim-Statement: 可用的反馈方法必须把一线证据、暂时判断、可逆试验和...",
    "candidate_type": "framework",
    "summary": "Claim-Statement: 可用的反馈方法必须把一线证据、暂时判断、可逆试验和独立坏消息通道组成闭环。",
    "evidence_ids": [
      "ev-20260806175133384117-43686885"
    ],
    "source_contexts": [
      "https://www.12371.cn/special/mzdxj/dyj/#investigation-practice::结构化主张：反馈完整性"
    ],
    "tags": [
      "methodology",
      "framework"
    ],
    "source_ids": [
      "https://www.12371.cn/special/mzdxj/dyj/#investigation-practice"
    ],
    "independence_groups": [
      "mao-authorized-works"
    ],
    "id": "candidate-20260806175133384126-02f8e7a9",
    "cross_domain": false,
    "source_independent": false,
    "predictive": false,
    "distinctive": true,
    "actionable": true,
    "status": "rejected",
    "rejection_reason": "V1 requires recurrence in at least two source contexts"
  },
  {
    "title": "Claim-Type: framework",
    "candidate_type": "framework",
    "summary": "Claim-Type: framework",
    "evidence_ids": [
      "ev-20260806175133384137-c6b8ed6b"
    ],
    "source_contexts": [
      "https://www.12371.cn/special/mzdxj/dyj/#investigation-practice::结构化主张：反馈完整性"
    ],
    "tags": [
      "methodology",
      "framework"
    ],
    "source_ids": [
      "https://www.12371.cn/special/mzdxj/dyj/#investigation-practice"
    ],
    "independence_groups": [
      "mao-authorized-works"
    ],
    "id": "candidate-20260806175133384144-1ef3e83d",
    "cross_domain": false,
    "source_independent": false,
    "predictive": false,
    "distinctive": false,
    "actionable": false,
    "status": "rejected",
    "rejection_reason": "V1 requires recurrence in at least two source contexts; candidate is not yet executable; candidate may be generic or underspecified"
  },
  {
    "title": "Claim-Statement: 历史文本的方法蒸馏必须区分最终公开版本、现场记录和...",
    "candidate_type": "framework",
    "summary": "Claim-Statement: 历史文本的方法蒸馏必须区分最终公开版本、现场记录和现代推断，不能伪造人物立场。",
    "evidence_ids": [
      "ev-20260806175133384228-dad13b0a"
    ],
    "source_contexts": [
      "https://www.12371.cn/special/mzdxj/dyj/#investigation-practice::结构化主张：版本与归属"
    ],
    "tags": [
      "methodology",
      "framework"
    ],